<?xml version="1.0" ?>
<!DOCTYPE scafacos_test  SYSTEM '../scafacos_test.dtd'>
<scafacos_test description="Testing particle generation." name="generate_test">
  <method>
    <param name="require_virial" value="1"/>
    <param name="direct_set_periodic_images" value="1,1,1"/>
    <param name="mmm2d_set_dielectric_contrasts" value0="0.999" value1="0.777"/>
  </method>
  <configuration box_a="10.0 0.0 0.0" box_b="0.0 10.0 0.0" box_c="0.0 0.0 10.0" epsilon="metallic" periodicity="0 0 0" decomposition="atomistic">
    <generate nlocal="100">
      <positions type="random" shape="box"/>
      <charges type="const" value="1.0"/>
    </generate>
  </configuration>
</scafacos_test>
